Fa_sentenc,En_aspect,En_sentiment
اولش می خواستم ۱۶ گیگ بگیرم. الان ۲ روزی هست که نسخه ی ۳۲ گیگ بدون گارانتی یک و شصت گرفتم. عالیه تا کسی نکسوس تو دستش نگیره و باهاش کار نکنه نمیفهمه چه جواهری هست این گوشی. داخل جعبش یه کابل تبدیل type c به micro هم هست. خیلی سریع هست و هیچ لگ و هنگی تو کارش نیست. فقط کیفت بلندگوش روی صدای بلند بد میشه که در مقابل خوبی هاش هیچه ,"['محصول ۳۲ گیگابایتی', ' کیفیت صدا']","[' Positive', ' Negative']"
اولش که استفاده میکنی خیلی خوب و با سرعت مناسب شارژ میکنه. ولی بعد از یکی دو ماه کابلش به علت پیچ خوردگی از داخل قطع میشه من ۲ تا خریدم که هر دو بعد از حدود ۲ ماه خراب شد. به هیچ عنوان پیشنهاد نمیکنم ,"['شارژ', ' کابل']","[' Positive', ' Negative']"
اولش که بگیرین ممکنه جالب باشه ولی به نظرم اصلا کاربردی نیست. اندازش بزرگه و برای دست های کوچیک مناسب نیست. باطری ضعیفش هم واسه همچین ساعت هایی قابل قبول نیست. در کل به نظر من اسباب بازیه. ,"['ساعت', ' انداز', ' دامنه کاربردی', ' باطری']","[' Negative', ' Negative', ' Negative', ' Negative']"
اولش که خریدم دکمه کیبوردش خراب بود همون اول دادم نمایندگی کیبوردشو تعویض کرد بعد با این مشخصاتش بازی need for speed rivals رو خیلی هنگ میکنه. یه بازی دیگم بود رو کیفیت ۱۹۲۰ هنگ میکرد مجبور شدم کیفیت بازیو بیارم پایین. فقط صفحه و بلندگو هاش قابل قبوله. واقعا بدترین لپ تاپی بود که تا حالا دیدم. از نمایندگی ایسوسم خریدمش. ,"[' لپ تاپ', ' دکمه کیبوردش', ' نمایندگی کیبوردشو', ' بازی need for speed rivals', ' کیفیت ۱۹۲۰', ' صفحه و بلندگو هاش', ' نمایندگی ایسوسم']","[' Negative', ' Negative', ' Positive', ' Negative', ' Negative', ' Neutral', ' Neutral ']"
اولش یکم تنده ولی با گذشت زمان بوش به مرکبات نزدیک میشه مشابه polar blue ژک ساف ماندگاری و پخش بوی متوسطی داره من مدل victor رو بیشتر دوست دارم ,"['بوش مرکبات', ' پolar blue ژک ساف', ' ماندگاری و پخش بوی متوسطی', ' مدل victor']","[' Neutral', ' Positive', ' Positive', ' Positive']"
اولین بار هست اچ تی سی میگیرم قبلا فقط سامسونگ میخریدم تا الان که گوشی خوبی بوده و مشکلی نداشته از لحاظ ظاهر هم زیباست نسبت به قیمتش بنظرم خیلی عالی هست چون الجی جی۶ با همین مقدار حافظه و همین پردازنده و Snapdragon ۸۲۱ یک میلیون گرونتر داره بفروش میره و انصافا قیمت این گوشی خیلی خوبه از لحاظ باطری هم برای من با وبگردی و شبکه های اجتماعی یک روز کامل جواب میده و بعضی وقتها یک روز و نیم جواب میده البته اینم بگم اصلا اهل بازی نیستم، گوشی هم تو ۹۰ دقیقه کامل شارژ میشه و سرعت شارژ خوبی داره ,"['گوشی', ' ظاهر', ' قیمت', ' پردازنده', ' باتری']","[' Positive', ' Positive', ' Positive', ' Neutral', ' Positive']"
"اولین چیزی که بعد از خریدن مودم باورم نمیشد کیفیت سیگنال وایرلسش بود. از این مودم کوچک انتظار همچین قدرتی نداشتم اصلا. کیفیت ارسال وایرلسش با مودم linksys ام تقریبا یکی بود!!! همچنین با ورود به تنظیمات مودم هم واقعا تعجب کردم! بازم انتظار تنظیمات پیشرفته در این حد رو نداشتم. تمامی امکاناتی که از یک مودم دارید رو برطرف میکنه! امکان port forwarding، DMZ، DHCP , IP Filter و خیلی امکانات دیگه که روی مودم های پیشرفته هستش رو دارید. ","['مودم', ' کیفیت سیگنال وایرلسش', ' تنظیمات مودم', ' قابلیت port forwarding، DMZ، DHCP ', ' IP Filter و خیلی امکانات دیگه']","[' Positive', ' Positive', ' Surprised (Positive)', ' Positive']"
"اولین چیزی که بعد از خریدن مودم باورم نمیشد کیفیت سیگنال وایرلسش بود. از این مودم کوچک انتظار همچین قدرتی نداشتم اصلا. کیفیت ارسال وایرلسش با مودم linksys ام تقریبا یکی بود!!! همچنین با ورود به تنظیمات مودم هم واقعا تعجب کردم! بازم انتظار تنظیمات پیشرفته در این حد رو نداشتم. تمامی امکاناتی که از یک مودم دارید رو برطرف میکنه! امکان port forwarding، DMZ، DHCP IP Filter , و خیلی امکانات دیگه که روی مودم های پیشرفته هستش رو دارید. ","['مودم', ' کیفیت سیگنال وایرلسش', ' قابلیت ارسال وایرلسش', ' تنظیمات مودم', ' امکانات مودم']","[' Neutral', ' Positive', ' Positive', ' Surprising/Positive', ' Positive']"
اولین گوشی اندرویدی تاریخ یادش بخیر هفت هشت سال پیش اخر کلاس بود ,['گوشی اندرویدی'],[' Neutral']
اونایی که نظر نا مربوط و بیخود میگن مشخصه که حتی این گوشیرو دستشونم نگرفتن. مشخصه که هرکی این گوشی رو خریده راضیه و توجه داشته باشید که شرکت سامسونگ واسه بابام نیست که بخوام ازش حمایت کنم ولی چون این گوشی رو خریدم و عالیه خواستم گول افراد بی سواد رو نخورید ,"['سامسونگ', ' قیمت']","[' Neutral', ' Neutral']"
اونیی که میخوان این گوشی رو بخرن مطمئن باشید اشتباه نمی کنید این گوشی از همه نظر عالی هستش و همه چی فوق العاده است مخصوصا دوربینش خیلی خوبه ,"['گوشی', ' دوربین', ' باتری']","[' Positive', ' Positive', ' Negative']"
اچ تی سی بعد از مدتها چند گوشی خوب و با کیفیت روانه بازار کرده که بکیش اچی تی سی یو الترا هستش با اینکه یک میانرده است ولی در حد یک پرچمدار ظاهر شده و چیزی کم نداره و مهمترین چیزی که این گوشی داره یکی دوربین و دیگری پردازنده اون هستش در اجرای بازی ها درسته حجم باطریش کمه و کمی زودتر خالی میشه اما خوب خیلی سریع تر هم باطری حجم کم پر میشه و پیشنهاد میکنم این گوشی رو حتما تهیه کنید از دیجی ,"['اچ تی سی یو الترا', ' دوروم', ' پردازنده', ' بازی ها', ' باتری']","[' Neutral', ' Positive', ' Neutral', ' Positive', ' Mixed (Positive and Negative)']"
اچ تی سی واقعا شرکته مطرحی هستش ولی به خاطر اینکه توی m۹ سنسور اثر نگذاشت خیلی از رقابت عقب موند من one x داشتم هنوزم که هنوزه خوبه اچ تی سی مشکلش سو مدیریته ,"['هت سی', ' Mixed', ' سنسور']",[' Neutral']
اچار رو توی شگفت انگیز با تخفیف خریدم مجموعهی کاملی از اچارها رو داره قطعات خیلی خوب به کاور داخلی چفت شدن ولی کاور زیاد در مقابل ضربات خارجی مقاوم بنظر نمیرسه کیفیت اچارها بنظرم متوسطه و انتظار کیفیت المانی رو نداشته باشید هر چند که مثلا المانیه ولی کیفیتش در حد محصولات متوسط دیگه هست و قابل قبوله یک ایرادی هم که داره اینه که زیاد در مقابل رطوبت مقاوم بنظر نمیاد و باید همیشه تو جای خشک نگهش داشت البته بقیهی اچارهای موجود توی بازار هم همین عیب رو دارن اکثرا توی شگفت انگیز و تقزیبا نصف قیمت خریدمش و راضیم ,"['شگفت انگیز', ' قطعات', ' Good', ' کاور داخلی چفت شدن', ' Good', ' مقاوم بنظر نمیرسه', ' کیفیت اچارها', ' Average', '  انتظار کیفیت المانی', ' رطوبت']","[' Positive', ' Neutral', ' Neutral', ' Negative']"
اکثر دوستان از این هدفون خیلی تعریف کرده بودن اما به نظر من اصلا لایق تعریف نیست. یه هدفون کاملا معمولیه و با قیمت عادی اصلا ارزش خرید نداره. باس قوی نداره و به شدت صدا را یکنواخت پخش میکنه به صورتی که بعد از نیم ساعت از گوش کردن موسیقی خسته میشید. صدا اصلا گرم نیست. دوستان با کمی هزینه بیشتر فیلیپس Tx ۱ را خریداری کنند. ,"['هدفون', ' قیمت', ' باس قوی', ' صدا']","[' Negative', ' Negative', ' Negative', ' Negative']"
اگر از گوشی هایی مثل سامسونگ و هواوی و ….. استفاده می کنید اصلا HTC نخرید. امکانات و رابط کاربری و کیبورد و …. خیییلی بده. باطریش که هیچی. خیلی ضعیفه به نظرم کلا HTC نخرین. هواوی بهتره. الانم پشیمونم … … البته بگم درسته که از دیجیکالا نگرفتم ولی اصل تایوان از آشنا گرفتم ,"['گوشی', ' امکانات', ' رابط کاربری', ' کیبورد', ' باطری']","[' Negative', ' Positive', ' Positive', ' Positive', ' Negative']"
اگر با دقت به گوشی های الان نگاه کنیم متوجه ی این می شویم که کمتر گوشی هردو دوربین ان ۱۶ است و اگر در اینترنت سرچ کنید می فهمید که این گوشی بهترین باتری را دارد وباهمچین صفحه ی نمایش وcpu قدرتمندی پیدا می شه که همچنین قیمت نه چندان زیادی داشته باشد ,"['گوشی', ' دوربین', ' قیمت', ' Not mentioned', '  صفحه ی نمایش', ' Not mentioned', ' cpu', ' Not mentioned']","[' Positive', ' Positive']"
اگر باتری خراب بشه دیگه کلا باید گوشیو بندازید دور چون قابلیت تعویض باتری نداره ولی در کل گوشی خوبیه ,"['باتری', ' قابلیت تعویض باتری', ' گوشی']","[' Negative', ' Negative', ' Positive']"
اگر بخوایم ظرفیت باطری و حافظه داخلیشو در نظر نگیریم گوشی خوبیه. دوربین خیلی عالی با رزولوشن بالا. اینترنت هم اگر ۴ باشه به خوبی ساپورت میکنه و اینکه نرم افزار های خوب و کاربردی داره و به نظر من قیمتش هم خیلی مناسبه. من خیلی از مدل های سامسونگ رو چک کردم ولی اگر بخوایم مزایاش رو با هم مقایسه کنیم این گوشی از هم رده های مارک سامسونگش قیمت پایین تری داره ,"['ظرفیت باطری و حافظه داخلی', ' دوربین', ' اینترنت', ' نرم افزار ها', ' قیمت']","[' Neutral', ' Positive', ' Positive', ' Positive', ' Positive']"
اگر برای مدت طولانی بخواهید هدفون رو توی گوشتون بگذارید، جنس فلزیش باعث میشه گوشتون درد بگیره. ولی در کل کیفیت ساخت و صدای بسیار خوبی داره. ,"['هدفون', ' جنس فلزیش', ' کیفیت ساخت', ' صدا']","[' Negative', ' Negative', ' Positive', ' Positive']"
اگر برند هایی مثل سنهایزر یا بیرداینامیک رو استفاده کرده باشید از کیفیت پخش این محصول اصلا راضی نخواهید شد. ولی نسبت به قیمتی که داره کار راه اندازه. ,"['برند', ' کیفیت پخش', ' قیمت']","[' Neutral', ' Negative', ' Neutral']"
اگر به دنبال گوشی خوب در این رنج قیمت هستید در خرید این گوشی شک نکنید من یک ماهه این گوشیو دارم و تا حالا نکته منفی توش ندیدم. در جواب بعضیا هم که میگن حسگر اثر انگشت خوب نیست هم میگم که زیاد هم بد نیست و من راحت ازش استفاده میکنم و از قدیم هم گفتن هر چی پول بدی آش میخوری. به نظر من که در میان گوشی های میان رده عالیه ,"['گوشی', ' قیمت', ' حسگر اثر انگشت']","[' Positive', ' Positive', ' Neutral']"
اگر به پوستتون اهمیت میدین و نمی خواید پیر شدید زود پوستتون بیوفته این عالیه چون از ته ترین حالت ممکن برای ریش تراش میزنه و مثل تیغ برای پوست ضرر نداره فقط یه خواهش از دیجی کالا دارم سری های این دستگاه بیارید ,"['پوست', ' ریش تراش']","[' Negative', ' Positive']"
اگر توی این رنج قیمت دنبال گوشی هستید a۵ بهترین گزینه است من یک ساله این گوشی رو دارم اگر بخوام گوشی دوم بگیرم یک a۵ دیگه میگیرم واقعا نسبت به قیمتش می ارزه و رقبای a۵ در مقابل این گوشی حرفی برای گفتن ندارن ,"['رنج قیمت', ' قیمت', ' گوشی']","[' Positive', ' Positive', ' Positive']"
اگر خط زن بهتر بود عالی میشد ,['اگر خط زن بهتر بود عالی میشد\nخط زن'],[' Positive']
اگر دنبال یه گوشی با صفحه بزرگ میگردید و دوست دارید سامسونگ بخرید و ب نظرتون note۵ قدیمی شده این گوشی واقعا عالیه اگر با ابعادش کنار بیاید. من خودم با این گوشی کار کردم و تجربه خیلی خوبی بود. باتری فوق العادس در میان رقبا. می تونید c۷ و a۸ ۲۰۱۶ رو هم در نظر بگیرید که هیچکدوم ضدآب نیستن. ,"['گوشی', ' صفحه بزرگ', ' سامسونگ', ' باتری', ' ابعادش', ' دستگاه c۷ و a۸ ۲۰۱۶']","[' Positive', ' Positive', ' Neutral', ' Positive', ' Neutral', ' Neutral']"
اگر دنبال یک بار تجربه کردن هستید و هزینه آن برای شما مهم نیست … باز هم نیاز نیست این را بخرید، میتوانید از محلهایی که این وسائل را برای شما برای چند دقیقه اجاره میدهند استفاده کنید، بی خود پولتان را هدر ندهید برای چشم های ضعیف که اصلا مناسب نیست و حالتون بد میشه برای بیزینس های خاص ابزار خوبیه ولی ابزاری نیست که بگیرید باهاش کار خاصی انجام بدید و سرگرم باشید ,"['وسائل', ' هزینه', ' چشم های ضعیف', ' بیزینس', ' ابزار\nوسائل']","[' Negative\nهزینه', ' Negative\nچشم های ضعife', ' Neutral\nبیزینس', ' Positive\nابزاری', ' Negative']"
اگر دنبال یک چراغ مطالعه شیک و مقاوم هستید این رو بخرید. ,['چراغ مطالعه'],[' Positive']
اگر دوست داری از صنعت داخل حمایت کنی و جنس خوبی هم بخری حتما این محصول را به شما پیشنهاد می کنم ,['محصول'],[' Positive']
اگر شما تدوینگر هستید حتما نیاز به یک هارد سریع و با طول عمر کاری بالا هستید. و طبق گفته های این شرکت وسترن دیجیتال ورژن بلک هارد دیسک هایی که داره بهتر هستند. ببینید دوستان اینقدر از صدای زیاد هارد شکایت نکنید، وقتی چرخش دیسک این هارد دیسک بسیار بالا هست پس در نتیجه صدایی هم که میده طبیعیه، حالا مدل های دیگر شرکت های دیگر هم بگیرید که مشخصات این هارد رو داشته باشه باز هم پر سر و صدا هست. تراکتور هم سر و صداش زیاده چون قوی تره، دلیل نمیشه بگیم با پراید باید زمین رو شخم زد! پس اگر تدوینگر یا شغلی دیگر دارید که به سرعت هارد بالا نیاز داره من اینو پیشنهاد میدم، اگر هم فقط برای بازی و فیلم میخواید پس ورژن RED از وسترن دیجیتال رو بگیرید، من با همین پول میتونستم یک وسترن دیجیتال ۶ترا قرمز بردارم ولی مشخصات سخت افزاریش به کارم نمیخورد. ,"['هارد', ' وسترن دیجیتال ورژن بلک هارد دیسک', ' صدا', ' تراکتور', ' قویت', ' وسترن دیجیتال ۶ترا قرمز']","[' Positive', ' Positive', ' Neutral (due to natural result of high disk rotation)', ' Positive', ' Positive', ' Negative']"
اگر مشخصات فنی و نقدهاش رو دنبال کرده باشید باید گفت که دیگه نهایت یک هدست برای گیمه.. ,['هدست'],[' Positive']
اگر میخواید با بودجه متوسط یه رم ۶۴ عالی بخرید توی خریدش شک نکنید سرعت انتقال اطلاعات واقعا حرف نداره ,['رم ۶۴'],[' Neutral']
اگر پیشنهاد شگفت انگیز این کالای مرغوب رو دیدید، درنگ نکنید محصولی بسیار با کیفیت از ۱more که از ظرافت صدای اون، خوشحال از خریدتون میشید. ,"['کالای مرغوب', ' ۱more', ' ظرافت صدای اون']","[' Neutral', ' Neutral', ' Positive']"
اگر یک مکنده قوی هم همراه داشته باشه واقعا از لحاظ کیفیت عالیه. من در کار کابینت وحجم دکوراسیون داخلی از این دستگاه استفاده میکنم. یک نقطه ضعف دیگه هم که داره تا سایز ۵۳ بیشتر فارسی نمیکنه. در مدل های جدیدتر هم تا سایز ۶۰. البته در طول زیاد حتما باید دونفر باشن. چون دستگاه کله میشه. ,"['مکنه قوی', ' قیمت']","[' Positive', ' Neutral']"
اگرچه شاید نت اغازین عطر خاص نبوده و ادم را دچار سردرگمی میکند اما نت میانی و پایانی ان با رایحه لیمو و پرتقال بسیار دلنشین و ملایم است و تا مدتها روی لباس شما باقی میماند و گاه و بیگاه شما را شگفت زده میکند در کل به عنوان یک عطر متوسط خوب با قیمت مقرون به صرفه برای استفاده روزانه مردانی با شخصیت موقر و ارام بسیار مناسب است ,"['عطر', ' نَت اغازین عطر', ' نت میانی و پایانی عطر', ' رایحه لیمو و پرتقال', ' قیمت', ' استفاده روزانه مردانی با شخصیت موقر و ارام']","[' Mixed (Positive-Negative)', ' Neutral', ' Positive', ' Positive', ' Positive', ' Positive']"
اگه استفاده از گوشی زیاد نداری مورد خوبیه و ارزش خرید داره نسبت به قیمت ولی باتری گوشی خیلی خیلی خیلی ضعیفه تو ۳ ساعت حدودا شارژ میشه و با استفاده متوسط در حد استفاده از برنامه های کاربردی وابسته به نت با وجود فعال سازی بهینه سازی مصرف باتری در عرض ۶ ساعت باتری به صفر درصد میرسه. و این یک فاجعه است. اگه مصرفت زیاده و امکان تهیه و حمل پاور بانک برات مشکلی نداره واقعا مورد خوبیه ,"['گوشی', ' قیمت', ' باتری']","[' Positive', ' Positive', ' Negative']"
اگه اصل این مدل هدفون رو داشتید و حالا میخواید دوباره بخرید پیشنهاد نمیکنم چون در مقایسه این ضعیف تره. درسته که یک مدل هستن ولی چون اصل نیست کیفیت خوبی در مقایسه با اصلش نداره. ولی اگه دنبال یه هندزفریه ارزان قیمت و متوسط هستید بخرید چون نسبت به قیمتش خوبه. ,"['هدفون', ' کیفیت', ' قیمت']","[' Neutral', ' Negative', ' Positive']"
