Fa_sentenc,En_aspect,En_sentiment
با سلام امروزه اغلب فشارسنجهای موجود در بازار ساخت چین و تحت لیسانس میباشد فشار سنج متوسطی هستش و بخاطر داشتن اداپتور و صفحه نمایش بزرگ برای افراد سالخورده مناسب هست جنس بدنه و مخصوصا کاف زیاد خوب نیس ولی برای استفاده خانگی جواب میده و دقت قابل قبولی داره در مقایسه با فشارسنج اصل المانی ضربان را دقیق نشون میده ولی فشار رو با یک واحد اختلاف که البته اونم نسبی هستش ,"['فشارسنج', ' اداپتور', ' صفحه نمایش بزرگ', ' جنس بدنه', ' کاف']","[' Neutral', ' Positive', ' Positive', ' Negative', ' Negative']"
با سلام اول از همه دوربین جلوی افتضااااااح ینی اگه داری سلفی میگیری خودت فقط معلومی بقل دستیات به صورت کامل تار هستند!!!! دوربین عقب هم فقط برا عکاسی ماکرو خوبه!! (به دلیل بالا بودن رزلوشن دوربین کیفیت خوبی داره) دیدم که میگم! حافظه داخلی کم (نسبت به پولی ک داری میدی) با این هزینه گزینه های بهتری روی میزه ینی اگه به عکاسی علاقه داری نخر که دلتو میزنه تعصبی هم نیستم که طرفداری برند های دیگه ای رو بکنم ولی عاقلانه خرید کنید! پول برند ندید ,"['دوربین جلوی', ' دوربین عقب', ' حافظه داخلی', ' قیمت']","[' Positive', ' Positive', ' Neutral/Negative', ' Negative']"
با سلام اولا از دیجی کالا برای سرعت عمل و کیفیت بالای خدمت رسانی تشکر می کنم  در خصوص خرید این کالا چون من برای جهیزیه می خواستم دنبال چنین سرویسی بودم ولی متاسفانه جنس رویه سرویس که مات هست باعث می شود که زودی روش خط و خش می افتد و ظاهرش رو سریع خراب میکند طوری که من ناخن کشیدم روی قاشق جاش خشش موند و چون این یه وسیله ای هست که دائما به بشقاب و میز و … می خوره احتمال اینکه ظاهرش سریع خش و خورده بشه هست.   اگه یه سرویسی باشه که روش استیل خالص باشه یه طرش جوری باشه که زود خراب نشه بهتره. ,"['دیجی کالا', ' قاشق جاش خشش موند', ' ظاهر']","[' Positive', ' Negative', ' Negative']"
با سلام اگر بخواهیم منصفانه قضاوت کنیم این گوشی با توجه به قیمت کارایی و عملکرد مناسبی دارد کیفیت صفحه نمایش و نور ان در حد متوسط و راضی کننده است سرعت اینترنت نسبتا خوب و در کارهای روزمره هنگ و لگی دیده نمیشود فقط تنها نقاط ضعف یکی دوربین و یکی باطری است که با توجه به قیمت طبیعی است ,"['گوشی', ' قیمت', ' کارایی و عملکرد', ' صفحه نمایش', ' Average', ' نور', ' Average', '  سرعت اینترنت', ' دوربین', ' باطری']","[' Neutral', ' Neutral', ' Positive', ' Positive', ' Negative', ' Negative']"
با سلام اگه میخوان پولتون رو دور بریزید از این گوشی بخرید از دستم افتاد روی فرش نصف صفحش سوخت موقع تماس هم صدای خش میده ,"['گوشی', ' صفحش', ' صدای خش میده']","[' Negative', ' Negative', ' Negative']"
با سلام این تبلت را حدود دو هفته پیش از دیجی کالا سفارش دادم و هم از تحویل بسته و هم خود محصول راضی هستم در حدود دو هفته کار از هر لحاظ البته به نسبت قیمتی که براش پرداخت کردم راضی هستم کیفیت و نور صفحه نمایش در حد متوسط هست صدای اسپیکر هم چندان جالب نیست دوربینش هم فقط کار راه اندازه فقط کم بودن حافظه داخلی و باتری ضعیف رو میشه براش خرده ایراد گرفت که اونم تو این رنج قیمت به نظر من قابل چشم پوشی هست در کل به نظر من برای خرید نسبت به قیمتش ارزش داره ,"['تبلت', ' تحویل بسته', ' محصول', ' نور صفحه نمایش', ' صدا', ' دوربین', ' حافظه داخلی', ' باتری']","[' Positive', ' Positive', ' Positive', ' Average (Positive)', ' Neutral', ' Average (Neutral)', ' Negative', ' Negative']"
با سلام این دستگاه برای پوست صورت ساخته شده و همین قدرت متوسط هم اگر بیش از یک دقیقه استفاده بشه پوست رو حساس میکنه در ضمن قیمتش مخصوصا با تخفیفی که خورده اصلا با براون قابل قیاس نیست. در کل در رنج خودش کارش رو خیلی خوب انجام میده و پوست رو کاملا تمیز و لایه برداری میکنه. توصیه میکنم بعد از استفاده حتما از ماسک های آب رسان. مرطوب کننده استفاده بشه. چون چربی پوست رو کاملا می گیره و این میزان خشکی پوست در دراز مدت باعث ایجاد چروک میشه. ,"['دستگاه', ' Power', ' Skin', ' مرطوب کننده']","[' Negative\nقیمت', ' Negative\nکارش', ' Positive\nپوست', ' Neutral\nماسک های آب رسان', ' Neutral']"
با سلام این سیم کیفیتش عالیه مخصوصا برای کسایی که بچه های شیطونی دارن ونگرانی در مورد قطع شدن سیم دارند نگرانیشون برطرف میشه سرعت شارژش عالیه و کیفیتشم خوبه ,['سیم'],[' Positive']
با سلام این محصول ایرانی نیست و ساخت چینه. اگه شما فکر میکنید تلویزیون یا محصولات دیگه با نام X. Vision ساخت ایرانه بازم اشتباه میکنید. ایران فقط اینارو مونتاژ و گارانتی میکنه و در اختیار مردم میذاره. البته من این کالا رو در پیشنهاد خریدم و واقعا از خریدم راضیم. نسبت به قیمتش واقعا عالیه. در خریدش شک نکنید با تشکر ,"['محصول ایرانی نیست و ساخت چینه', ' قیمت']","[' Negative', ' Positive']"
با سلام این محصول رو به عنوان هدیه گرفتم برای یکی از دوستانم خب انتظار چندانی ازش نمیره با توجه به قیمتش کیفیت صداش هم متوسط هست ولی بیشتر برای سرهای بزرگ مناسبه درکل اگه سخت گیر نباشی راضیت میکنه فکر میکنم اگه تو تخفیف شگفت انگیز بتونی بخری خیلی ارزش خرید بالاتری داشته باشه ,"['محصول', ' قیمت', ' صدا', ' سرهای بزرگ', ' تخفیف']","[' Neutral', ' Neutral', ' Average (Positive)', ' Positive', ' Positive']"
با سلام این مطلب رو برای اون دسته از دوستانی میزارم که میخوان مودم خوب، بصرفه و با امکانات معقول بخرن من حدود ۹ماه این مودم رو خریدم البته باقیمتی کمتر از این، قبل اون هم با کلی مودم کار کردم از وایرلس بگیر تا usb … ۱-مکانی که گوشی آنتن ضعیف بود این مودم آنتن قابل قبولی داشت ۲-راحت میشه به یه پاور بانک وصلش کرد و همه جا برد (به شارژر موبایل به راحتی وصل میشه، داخل ماشین هم میشه استفاده کرد ۳-اگه با سیم کارت ایرانسل میخوایین استفاده کنین با برنامه ایرانسل من راحت میشه شارژ خرید ۴-برنامه hi link هواوی رو هم نصب کنید راحت میتونید هر تنظیمی که میخوایین روی مودم انجام بدین به نظر شخصی این مدل خیلی بهتر از مدل های گرون قیمت هست ,"['مودم', ' آنتن مودم', ' راحت استفاده از پاور بانک', ' قابلیت شارژ خرید با سیم کارت ایرانسل', ' برنامه hi link هواوی', ' قیمت', ' Better than expected']","[' Positive', ' Positive', ' Positive', ' Neutral', ' Positive']"
با سلام این نقد رو بعد از تحویل گرفتن نوشتم من از دیجیکالا خرید نکردم و از بازار خریدم و رنگ آبی هم هست اولش شک داشتم اما واقعا رنگ آبی ش از همه رنگ ها زیبا تره و کیفیت صفحه نمایشش عالیه من این لبتاپ رو به عنوان دم دستی گرفتم و لبتاپ اصلی ام lenovo y۷۰۰ ه این لبتاپ از نظر کیفیت صفحه چیزی از y۷۰۰ کم نداره! با اینکه حدود اختلاف قیمت دارند!!!!! اما از نظر سخت افزار رام اش خیلی پایینه و هم چنین حافظه داخلی اش اذیت کننده است اما به نظر من خیلی وسیله بدرد بخوریه. ,"['لپتاپ', '\nرنگ آبی لپتاپ', '\nصفحه نمایش لپتاپ', '\nسخت افزار لپتاپ رام', '\nسخت افزار لپتاپ حافظه داخلی']","[' Overall Positive', ' Positive', ' Positive', ' Negative', ' Negative']"
با سلام این هارد بعد از مدتی سرعتش خیلی میاد پایین من ۱۰ عددشو خریدم برای مشتریهام چقدر درگیر شدم و باهاشون بگو مگو کردم چنتاشون زوری پسم دادن و چنتاشون فرستادن گارانتی ,"['هارد', ' قیمت', ' Not mentioned']",[' Negative']
با سلام این هدفون امروز ب دستم رسید ارگونومی عالی تا ۱۰ متر هم آنتن میداد فقط اگه چند تا کار با گوشی کنید یک لحظه گیر میکنه فقط همین بهتون پیشنهاد میکنم بخرید ,"['هدفون', ' ارگونومی', ' آنتن', ' کار با گوشی']","[' Neutral', ' Positive', ' Positive', ' Negative']"
با سلام این پاور کاملا مغایر با توضیحات ارائه شدی در معرفی محصول بوسیله سایت، هست کاملا بی کیفیت هست و خیلی زود خراب می شه میزان واقعی توان این پاور حدود ۶ هزارمیلی آمپر هست ,"['پاور', ' توان پاور']","[' Negative', ' Negative']"
با سلام این پرینترو ۲ هفتس از دیجیکالا خریدم. کیفیت چاپ اون نسبتا خوبه ولی یه مقدار کیفیت رنگ پایین و تصاویر چاپی بی روح هستند. از کاغذ عکس ۲۶۵ گرمی کداک هم که استفاده کردم تغییر چندانی نداشن. از دوستان کسی تنظیمات رنگ و شفافیت چاپ این پرینترو میدونه. ,"['پرینتر', ' Good quality of print', ' رنگ', ' Low quality', ' تصاویر چاپی', ' Lifeless']","[' Neutral', ' Negative', ' Negative']"
با سلام این چاپ گر من حدود ۳ ماه خریده ام بسیار عالی و مخصوص مصارف خانگی هست و خیلی هم پر کاربرد. بنده پیشنهاد می کنم، برای شارژ کردنش هم با هزینه کم قابل شارژ هست &#۱۷۱;کافی چهار رنگ اصلی زرد، قرمز، ابی و سیاه را که اکثر فروشگاه هم دارند تهیه کرده و با سرنگ دو میلی لیتری به کارتریج تزریق کنید. توضیحات بیشتر در اینترنت گفته اند. &#۱۸۷; هرکس موفق هست لایک کنه ,"['چاپ گر', ' قیمت']","[' Positive', ' Neutral']"
با سلام این چراغ فانوسی تازه به دستم رسیده ساخت چین هست نوردهیش قابل قبوله تو پیشنهاد شگفت انگیز ارزش خرید داره طراحیش خوبه ولی کیفیت بدنه متوسط هست کابل شارژش کوتاهه در کل برای هرخونهای نیازه ,"['چراغ فانوسی', ' نوردهیش', ' طراحیش', ' کیفیت بدنه', ' کابل شارژش']","[' Positive', ' Positive', ' Positive', ' Neutral', ' Negative']"
با سلام این کالا دیروز دستم رسید خیلی خوب بود رنگ خیلی خوبی داره و میشه راحت بصورت روزمره استفاده کرد اصلا تند و زننده نیست و اینکه خیلی نرم و لطیف هستش. ,"['کالا', ' رنگ', ' میشه استفاده بصورت روزمره', ' تند و زننده نیست', ' نرم و لطیف هستش']","[' Positive', ' Positive', ' Positive', ' Positive', ' Positive']"
با سلام این گوشی از همه نظر عالیه با توجه به ۵ ماه استفاده بازی های سنگین رو بدون لگ و با سرعت بالا اجرا میکنه کیفیت صفحه نمایش فوق العاده هست کیفیت دوربین ها عالی است حتی در نور کم تا حالا حتی یک بار هم هنگ نکرده مقاومتش بد نیست پیشنهاد می کنم برای گلس و جلد بخرید حسگر اثر انگشتش خیلی سریع و با دقت بالا عمل میکنه در حد یه اشاره همه امکاناتش عالی هست به جز کیبوردش به نظرم بهتره از کیبورد خودش استفاده نکنید. موفق باشین به امید دیدار ,"['گوشی', ' \nکیفیت صفحه نمایش', ' \nکیفیت دوربین ها', ' \nRESISTANCE', ' \nحسگر اثر انگشت', ' \nکیبورد']","[' Positive', ' Positive', ' Positive', ' Neutral', ' Positive', ' Negative']"
با سلام این گوشی همچیش عالیه هرکس میخاد بخره شک نکنه اثر انگشت تو ۰٫۲ ثانیه باز میکنه یعنی فوق العاده دوربین اصلی راصی کننده و عالیه دوربین سلفی هم در حد خودش هست ی پیشنهاد: هرکس خواست بخره حتما بیمه کنه چون بسیار شکننده و ظریفه باتری هم برای من دو روز راحت دوام میاره ب وای فای وصلم نور صفحه زیاد و همش تو نت یعنی باتری حرف نداره ارزش داره شک نکنید اگه هم میخاید ببیند گوشیتون اصله یا نه کد #۰۶#* رو بگیر و ببیند ک کد هفتم و هشتمش چنده اگه ۰۸ باشه یعنی اصله و ساخت آلمان و درجه یکه اگه تونستم راهنماییتون کنم لایک کنید ,"['گوشی', ' دوربین اصلی', ' دوربین سلفی', ' پایه', ' باتری', ' وای فای و صلم نور صفحه']","[' Positive', ' Positive', ' Positive', ' Positive', ' Positive', ' Neutral']"
با سلام این گوشی یک ماهی هست خریدم همه چیزش عالیه البته با توجه به قیمتش و فقط تنها ایرادش اینه که تاچش خیلی به ندت برای چند ثانیه ای کند میشه اونهم در شرایطی که چند ساعت مداوم باهاش کار کنیکه با توجه به مزیتهای دیگش اصلا منو اذیت نمیکنه. به نظرم با توجه به باتری خیلی خوبش و دوربین درحد انتظار، با این قیمت هزینه بهترین گوشی بود که میتونستم بخرم. ,"['گوشی', ' قیمت', ' تچ', ' باتری', ' دوربین']","[' Positive', ' Neutral', ' Negative', ' Positive', ' Positive']"
با سلام اینکه در وزن کشیهای مختلف مقادیر متفاوتی رو نشون میده به علت اختلاف در ایستادن روی سطح ترازو هستش و در حد چند صد گرم میباشد و از یک کیلو بیشتر نیس گرچه شکل ترازو مزیت حساب نمیشه ولی طراحی شیکی داره و یه ترازوی متوسط هستش و برای استفاده در خونه فک کنم دقتش قابل قبوله ,"['وزن کشیها', ' ترازو', ' شکل ترازو', ' طراحی شیکی', ' طراحی ترازوی متوسط', ' استفاده در خونه']","[' Neutral', ' Neutral', ' Neutral', ' Positive', ' Neutral', ' Neutral']"
با سلام ببینید دوستان این لپ تاپ هرچی هم که باشه واقعا با این قیمتی که یه گوشی هوآوی بدرد نخور هم بهتون نمیدن بازم خوبه این لپ تاپ کیفیت صفحه نمایش خوبی داره از لحاظ ظاهری هم خوشگله سرعتش هم تقریبا خوبه و من تو این سه روز هنگ ازش ندیم ولی بزرگترین ایرادش کیفیت ساخت فوق العاده بدش هست بطوری که وقتی میخواید لپ تاپ رو ببندید و باز کنید واقعا استرس بدی بهتون وارد میشه که هر آن ممکنه بشکنه و همینم هست!!! تو این سه روز دوتا ترک نه چندان کوچیک روی لپ تاپ منم به وجود اومده با این که خیلی هم با احتیاط باهاش کار کردم. لولا های خیلی خشک و بدی داره. اسپیکر ها هم زیر لپ تاپ هستن که یه نقطه ضعف محسوب میشه. تاچ پدش یکمی گیج میزنه اما اینکه بگم بدرد نخوره اوج نامردیه منو میرسونه!! کلا من سخت افزار تقریبا خوبش کیفیت خوب صفحه نمایش و زیبایی لپ تاپ رو خیلی نقاط عطف خوبی میدونم و واقعا با این قیمت بسیار گزینه ی مناسبی محسوب میشه. بازم میگم واسه من غیر از جنس بدنه و کیفیت ساخت یه لپ تاپ خیلی عالی محسوب میشه اگه مفید بود لایک یادتون نره. موفق باشید ,"['لپ تاپ', '\nصفحه نمایش', '\nظاهر', '\n سرعت', '\nساخت کیفیت', '\nقیمت', '\nجنس بدنه', '\nاسپیکر ها', '\nتچ پد']","[' Positive', ' Positive', ' Positive', ' Neutral', ' Negative', ' Positive', ' Negative', ' Negative', ' Slightly Negative']"
با سلام برای اون دسته از عزیزانی که شک دارن در خرید این محصول باید عرض کنم که این دستگاه بهترینه برای پاک کردن آرایش توی یک هفته ای که استفاده کردم صورتم صاف شده قبلا با قوی ترین پاک کننده هام تمیزش میکردم در حد یک ساعت تمیز میموند الان دیگه تمیز میمونه انگار معجزه شده خیییییییلی پیشنهاد میکنم به اونایی که مثل من پوست چربی دارن حتما بگیرید تا استفاده نکنی متوجه نمیشی چی میگم در یک کلام دست سازندش درد نکنه فقط کاش برای جدا کردن برس از دستگاه دکمه ای چیزی میزاشت باید محکم بکشیش بیرون مرسی از وقتی که گذاشتین موفق باشین ,"['دستگاه پاک کننده آرایش', ' قابلیت پاک کردن سریع', ' پاک کننده قوی سابق', ' دکمه جدا برس از دستگاه']","[' Positive', ' Positive', ' Negative', ' Neutral']"
با سلام بعد از کلی تحقیق این آسیاب رو انتخاب کردم چون بی نظیر هستش و برای منی ک در روز ۴۰ گرم قهوه اسیاب میکنم واسه اسپرسو عالیه فقط توی ۲۰ثانیه قهوه پودر شده یک دست عالی بهتون تحویل میده ,"['سی آسیاب', ' قهوه پودر شدن']","[' Positive', ' Positive']"
با سلام بنده این گوشی رو از دیجی خریدم دمشون گرم ساخت ویتنامو برام فرستادن تشکر میکنم ازشون بخاطر اصلی بودن گوشی وهمین طور گارانتی وسیم کارت همراه اولی که داخل جعبه بود دوستان میخوام بگم اگر تو این رنج قیمت میخوائید گوشی بخرید فقط همین مدل خوبه از هر نظر راضیتون میکنه حرف نداره با خیال راحت بخرید توی محل ساخت چینیشو با گارانتی اینتر گفتن که کیفیته اینو نداره امیدوارم کمکی کرده باشم بازم دمه دیجیکالا گرم با سپاس ,"['ساخت ویتنام', ' قیمت', ' راضیتون میکنه از هر نظر', ' گارانتی', ' سیم کارت همراه اولی']","[' Neutral', ' Neutral', ' Positive', ' Positive', ' Positive']"
با سلام بنده بدلیل فعالیتم در بازار بورس و فارکس، نیاز داشتم که همیشه در لپ تاپم اینترنت همراه داشته باشم و به واسطه ی دوستان با این مودم آشنا شدم. نکته ی جالب اینه که میتونید مثلا مودم رو به دستگاهCDماشین وصل کنید و کل ماشین اینترنت داشته باشه، یا به آداپتور شارژر وصل کنید و کل خونه اینترنت داشته باشه، یا حتی به پاوربانک و یا به کمک رابطOTGبه موبایل وصل کنید. من با خرید این مودم، دیگه برای موبایلم اینترنت نمیخرم. بسیار از کیفیت و سرعت مودم راضی ام و نیازهامو در سطح متوسط و بالاتر رفع کرده و تنها مشکلش عدم وجود قابلیت وارد کردن کدهایUSSDهست که بهترین راه حل فکر میکنم خرید اینترنتی بسته های اینترنتی هست. همچنین این مودم قابلیت مک فیلترینگ (افزودن مک آدرس) داره و همراهش یه سیمکارت ایرانسل هدیه داره. ,"['مودم', ' کیفیت', ' سرعت', ' متوسط و بالاتر رفع کردن نیازها', ' قابلیت مک فیلترینگ', ' قابلیت وارد کردن کدهای USSD']","[' Positive', ' Positive', ' Positive', ' Positive', ' Positive', ' Negative']"
با سلام بنده بعد از چند ماه تحقیق این مدل رو گرفتم البته ترجیح دادم به جای یک دریل پیچ گوشتی شارژی گران قیمت یک دریل (برقی) مطمئنتر از لحاظ قدرت بگیرم و یک دریل پیچگوشتی شارژی فقط برای پیچها و کارای سبک و چوبی بنده خودم روی برندهای ژاپنی تعصب دارم اما نظرمرو بعد از ۲ روز استفاده بدون تعصب میگم این دستگاه قدرت خوبی داره نسبت به باطری و توانش اما کیفیت پلاستیکی بدنه جالب نیست جنس پلاستیک کیف هم همینطور -اما از نظر فنی قابل قبول بود سریهای پیچ گوشتی هم متوسط بود با یک ساعت شارژ ۲٫۳ ساعت کار مداوم انجام دادم و مشکلی نداشت در مجموع با توجه به قیمت بسیار قابل قبول و خرید خوبی بود (البته در شگفت انگیز) ممنون از دیجی واسه ارسال خوبش ,"['دريل برقی', ' قدرت', ' پلاستیکی بدنه', ' کیف پلاستیک', ' سریهای پیچ گوشتی', ' Average', ' شارژ و توانش']","[' Positive', ' Positive', ' Negative', ' Negative', ' Positive']"
"با سلام به دوستان اینکه گوشی در مقایسه با A۵ ۲۰۱۷ دو ویژگی خوب دارد: ۱. صفحه بزرگتر ۲. قدرت بیشتر باتری لذا این گوشی برای کسانی که بیشتر از نوشتن و خواندن متن و یا دیدن ویدیو و عکس استفاده می کنند بسیار مناسبتر از A۵ ۲۰۱۷ است. در ضمن با اینکه در مشخصات بسیاری با هم فرق ندارند، ولی ممکن است در واقع A۷ ۲۰۱۷ با کیفیت تر و کمی سرتر باشد. با تشکر "" انتخاب ما همین است "" ",['گوشی'],"[' Positive\nصفحه بزرگتر', ' Positive\nقدرت بیشتر باتری', ' Positive\nA۵ ۲۰۱۷', ' Neutral\nA۷ ۲۰۱۷', ' Neutral']"
