Fa_sentenc,En_aspect,En_sentiment
این چراغو من پارسال خریدم از نظر چرخش در زوایای مختلف خیلی خوبه تنها ایرادی که میتونم بهش بگیرم اتصال پایه ضعیفش به میزه. گیره به میز وصل میشه و پایه چراغ توش قرار میگیره ینی یه اتصال ۵سانتی که اکه یهو دستتون بخوره به وراغ از توی پایش درمیاد ,"['چراغ', ' چرخش در زوایات مختلف', ' اتصال پایه']","[' Positive', ' Positive', ' Negative']"
این چمدان نسبت به قیمتش واقعا عالیه رنگش بسیار زیباست جنسش عالیه محفظه های زیادی داره قفلش در همان لحظه ای که دم در داشتم تست میکردم خراب شد (فقط چمدان کوچک قفلش سالم است) من کاملا از خریدم راضی هستم مرسی از دیجی جون ,"['چمدان', ' قیمت', ' رنگ', ' جنس', ' محفظه ها', ' قفل', ' Mixed']","[' Positive', ' Positive', ' Positive', ' Positive', ' Positive']"
این چی بود خدایش به اینم میگید کتاب حداقل در توضیحات قید کنید که این کتاب برگرفته از پایان نامه اس و بیشتر مطالب او فقط کپی پیست شده است. اصلا ربطی به پایگاه داده ندارد. من تعجب میکنم از دیجیکالا که کتاب به این ضعیفی رو برای فروش قرار داده است. من خیلی پشیمونم بابت پولی که به این کتاب دادم ,"['کتاب', ' توضیحات', ' مطالب', ' پایگاه داده']","[' Negative', ' Neutral', ' Negative', ' Negative']"
این چیزایی که میگن در موردش که سایه میندازه برا من پیش نیومده ولی بدترین دوربین رو داره عکسهایی که باهاش میندازی برابری می کنه با یه گوشی سامسونگ ارزون قیمت ,"['درون', ' قیمت']","[' Negative', ' Neutral']"
این چیزایی که میگن در موردش که سایه میندازه برا من پیش نیومده ولی بدترین دوربین عکسهایی رو داره که باهاش میندازی برابری می کنه با یه گوشی سامسونگ ارزون قیمت ,"['دوربین', ' قیمت']","[' Negative', ' Neutral']"
این ک حجمش کم تر از ۱۶ گیگه طبیعیه و توی همه ی فلش ها همینه … … … ….. ,"['محصول', ' حجمش']","[' Negative', ' Negative']"
این کابل خوبه ولی متاسفانه جنسش افتضاحه من خریدمش یه ناخونم مالیده شد بهش ناخونم تیز نبود ها تازه ناخونم گرفته بودم، یه زره ناخونم مالیده شد روش اونوقت یکمش پاره شد. ,"['کابل', ' جنس کابل', ' ناخونم تیز', ' زره ناخونم']","[' Neutral', ' Negative', ' Negative', ' Negative']"
این کابل دیروز به دستم رسید کابل بسیار خوبیه پیشنهاد میکنم بخرید ,['کابل'],[' Positive']
این کابل شارژ از کابل شارژای تقلبی تو بازار خیلی بهتره تو سرعت فست شارژر خللی ایجاد نمی کنه بسیار با کیفیته که اینو حتی از بسته بندیش می فهمین ,['کابل شارژ'],[' Positive']
این کارت حافظه نسبت به بقیه قیمت خیلی کمی داره چون برند معروفی نیست اما ۵ سال ضمانت خیال ادمو راحت میکنه در مورد سرعتش هم باید بگم نه زیاده و نه کم بهش نمیخوره کلاس ۱۰ باشه سرعت خوندن و نوشتنش متوسطه ,"['کارت حافظه', ' قیمت', ' برند', ' ضمانت', ' سرعت خوندن و نوشتنش']","[' Neutral', ' Positive', ' Neutral', ' Positive', ' Neutral']"
این کالا از لحاط شکل ظاهری زیباست و تصویر خیلی خوبی داره. کارایی خوبی هم داره تمام این ویژگی ها در برابر قیمت بسیار مناسبش، بسیار ارزشمند است. خرید این کالا را به تمام دوستان دیجی کالایی توصیه میکنم. باتشکر ,"['کالا', ' شکل ظاهری', ' تصیمار', ' کارایی', ' قیمت']","[' Positive', ' Positive', ' Positive', ' Positive', ' Neutral']"
این کالا رو خریدم کیفیت ساختش متوسطه نمیتونم بگم عالیه نه بگم بده اما بزرگترین مشکلی که داره سوکتهای کوچیک برقش هست که مخصوص دو شاخههای خاصی هست اما متاسفانه همون دو شاخهها هم توش جا نمیشه چون حدود یک میلیمتر کوچیکتر از اندازه استاندارده من الان عملا ۴ تا سوکت دارم نه ۸ تا اما خروجیهای یو اس بی ش خوبه با امپر مناسب و شارژ دهی خوب امیدوارم سازنده این کالا این ایراد رو بر طرف کنه ,"['سوکتها', ' کیفیت ساخت', '  شارژ دهی', ' خروجیهای یو اس بی']","[' Negative', ' Neutral', ' Positive', ' Positive']"
این کالا رو در پیشنهاد ویژه دیجی کالا گرفتم که قیمتش یک سوم قیمت عادی بود؛ من نظرات منفی دوستان رو خوندم و خیلی تعجب کردم، کیفیت صدا و بیس و … سلیقه ای هست و همچنین باید درست مقایسه شوند، نباید هدفونی که سی هزار توی پیشنهاد ویژه گرفتید رو با سنهایزر نهصد هزاری قیاس کنید یا حتی با کریتیو سیصد تومنی، از نظر من که سالها هدفون های سونی و سامسونگ و سنهایزر و فیلیپس و … داشتم با این قیمت این هدفون عالیه، بیس بسیار مناسبه که اصلا اذیت نمیکنه، از گوش خارج نمیشه، دارای سه سر گوشی هست، کیفیت بدنه خوبه و ارگونومی عالی امکان نداره از گوشتون بیفته، بازم میگم تو پیشنهاد ویژه بسیار ارزشمنده ولی در قیمت عادی گزینه های بهتری وجود داره، مخصوصا کریتیو و سنهایزر، کیفیت صدای خروجی جوریه که ساعتها آهنگ گوش بدید، گوش درد نمی گیرید البته با صدای معقول، موفق باشید ,"['صدا و بیس', ' کیفیت بدنه', ' ارگونومی', ' سه سر گوشی', ' قیمت']","[' Positive', ' Positive', ' Positive', ' Positive', ' Neutral']"
این کالا رو دو روز پیش از دیجیکالا خریدم و بعد از مشاهدهی فایلهای تصویری با کیفیتها و رنگهای مختلف از روی دیوایسهای مختلف (لپتاپ- هارد اکسترنال- پلیاستیشن۳) این نقد رو مینویسم من برند تلوزیون همیشه برام مهمترین فاکتور بوده و به هیچوجه به برندی جز سونی و سامسونگ فکر نمیکردم تا دیجیکالا این تلوزیون رو در پیشنهاد ویژه گذاشت و بعد از خوندن نقدهای کاربرهای دیگه و گارانتی معتبر ایرانرهجو تصمیم گرفتم که ریسک کنم و این محصول رو بخرم دیشب تلوزیون به دستم رسید و از ایران رهجو برای نصبش اومدن اولین تصویری که با تلوزیون دیدم یک فیم ۱۰۸۰p بود که از روی هارد اکسترنال پخش کردم و کیفیتش تو ذوقم زد اما بعد لپتاپم رو وصل کردم و همون فایل رو پخش کردم و کمی هم با تنظیمات تصویرش بازی کردم و نتیجه خیلی مطلوب بود توقع گرفتن تصویر در حد تلوزیونهای درجه۱ سامسونگ و سونی و پخش با اون شفافیت رو نباید از این تلوزیون داشت اما من قبل از این یک ۴۹اینچ الجی با همین مشخصات داشتم و واقعا میگم که کیفیت تصویرشون در یک حد بود و شاید حتی این کمی طبیعیتر هم بودن رنگهاش من از خریدم کاملا راضیم البته اگر برام پول هیچ اهمیتی نداشت ترجیح میدادم سونی بگیرم یا سامسونگ اما با قیمتی که من این تلوزیون رو گرفتم از پیشنهاد ویژهی دیجیکالا خریدی کاملا مناسب بوده و اگر دوباره همچین موقعیتی پیش بیاد قطعا همین تلوزیون رو میخرم چون هم خودم هم چند تا از دوستانم که حساسن روی کیفیت تصویر و اونها هم کاملا راضی بودن و نتوستن عیبی روش بذارن تنها نکات منفیش هم یکی کنترلش بود که خیلی راحت نیست و کمی هم کنده اما کاربریش بسیار کامله و با داشتن پوینتر و کیبورد خیلی کار رو ساده میکنه بعد از اون هم اسپیکرهاش هست که با اینکه حجم صدای خیلی بالایی داره اما کیفیتش متوسطه و توصیه میکنم از سیستم صوتی مجزا استفاده کنید ,"['تلوزیون', ' برند تلوزیون', ' کیفیت تصویر', ' قیمت', ' کنترل', ' اسپیکرها']","[' Positive', ' Positive', ' Positive', ' Positive', ' Neutral/Negative', ' Neutral']"
این کالا رو چند روز پیش برای میز کارم خریدم باید خدمتتون عرض کنم فقط تو زمینه قیمت میتونه گزینه مناسبی باشه و در غیر این صورت خیر کیفیت پلاستیک به کار رفته به شدت بد هستش تمام بدنه دارای رنگ پریدگی می باشد و سر پیچ هم به زور لامپ داخلش قرار گرفت از همه بدتر چراغ به وضوح استفاده شده بود و تمام پایش دارای خط و خش و خوردگی بود شاید کالای من دارای این مشکلات بوده و باقی دوستان این مشکلات رو نداشتن در هر صورت میخواستم مرجوعش کنم که گفتم با این قیمت ارزش مدت زیادی معطلی رو نداره و مستقیم به سطل زباله منتقل شد از دیجی کالای عزیز خواهش میکنم زمانی بسته بندی کالاها و قبل ارسال یک بار کالاها رو کنترل کیفیت کنن ببینن اگر مشکلی داره همونجا مرجوع کنن نه اینکه بفرستن و من مشتری بخوام اینکارو بکنم چون مبلغ سی تومن چیز خاصی نیست اما باعث میشه این اتفاقات به اسم دیجی کالا ثبت بشه و نه تامین کننده ,"['میز کار', ' قیمت', ' کیفیت پلاستیک', ' رنگ پریدگی بدنه', ' سر پیچ لامپ', ' چراغ وضوح استفاده شده بود', ' پای پایش دارای خط و خش و خوردگی']","[' Neutral', ' Positive', ' Negative', ' Negative', ' Negative', ' Negative', ' Negative']"
این کالا ساخت چین است. اولین چیزی که بعد از باز کردن کارتن به چشم میاد کیفیت ساخت پایین یعنی به نظر میرسه که ارزش بهای پرداختی را در ظاهر نداره اما کیفیت پختش خوب و کاملا راضی کننده س سیمش کوتاهه تنها با اتصال دوشاخه به پریز روشن میشه حتما براش تبدیل دوشاخه تهیه کنید، در توضیحات محصول ذکر شده بود که کاردک برای تمیز کردن سینی ها وجود داره اما در کارتنش موجود نبود ,"['کالا ساخت چین است', ' کیفیت ساخت پایین', ' پختش خوب', ' سیمش کوتاهه', ' اتصالات دوشاخه پریز روشن میشه', ' دوشاخه تبدیل براش حتما باید تهیه کنید', ' کاردک تمیز کردن سینی ها']","[' Neutral', ' Negative', ' Positive', ' Neutral', ' Neutral', ' Neutral', ' Negative']"
این کالا که بدستم رسید که از فروشگاه انتخاب خریدم من فکر میکردم ساخت ویتنام باشه که ساخت چین بود درخواست مرجوع شدن کالا رو دادم کیفیت صدا متوسط با برنامه samsung level هم هماهنگ نمیشه از نایلکس روی بسته بندی میشد فهمید که توی یه مغازه سه در چهار تو چین مونتاژ میشه اصلا پیشنهاد نمیکنم که بخرید احتمالا اخرین خرید از دیجی کالا رو انجام دادم و دیگه این اشتباه رو نمیکنم ,"['کالا', ' ساخت چین', ' کیفیت صدا', ' نایلکس روی بسته بندی', ' مونتاژ در چین', ' پیشنهاد نمیکنم']","[' Negative', ' Neutral', ' Negative', ' Neutral', ' Neutral', ' Negative']"
این کتاب به درد ۵ سال پیش مخوره و اطلاعاتش هم مال همون موقع هاست گرایش های مردم و سخت افزار ها و … امروزه عوض شده داستانش شما نمیتونید به عنوان ترند از این کتاب اطلاعات به روزی بگیرد و بهتره برید سراغ آمار و اطلاعات بروز تر به نظر من که خوندم تاریخ مصرف این کتاب گذشته و شاید عمل بر اساس دانشی که این کتاب بهتون بده سرخورده تون کنه. حتما دانش بروز تری رو برای ورود به همچین بازاری لازم دارین. موفق باشید. ,"['کتاب', ' اطلاعات', ' گرایش ها و سخت افزار ها', ' Outdated', ' داستانش', ' Not Useful', ' آمار و اطلاعات بروز تری', ' Needed']","[' Negative', ' Negative']"
این کتاب به هیچ وجه ارزش علمی نداره و بیشتر شبیه یک رمان ناموفق است. از لحاظ تخصص در این کتاب چیزی وجود نداره بغیر از یک سری موارد اپتدایی و بدیهی. درحقیقت این کتاب چیزی نیست به جز زندگی نامه آقای چاد! ,"['کتاب', ' ارزش علمی', ' رمان ناموفق', ' سپécialism', ' مatters اپتدایی و بدیهی', ' زندگی نامه آقای چاد']","[' Negative', ' Negative', ' Negative', ' Negative', ' Neutral', ' Positive']"
این کتاب محشره، خیلی عالیه نقاط ضعف نداره کلا ,"['کتاب', ' نقاط ضعف']","[' Positive', ' Negative']"
این کتاب یکی از بهترین کتابایی بوده که من خوندم. داستان جذابی داره و خیلی خوب ترجمه شده به شکلی که آدم کاملا می تونه حس مورد نظر نویسنده رو دریافت کنه. به شدت توصیه میکنم این کتاب رو. ,"['کتاب', ' داستان', ' ترجمه', ' نویسنده']","[' Positive', ' Positive', ' Positive', ' Positive']"
این کرم برا پوستهای خشک عالیه چربی متوسطی داره و بسیار اثربخشه در مقابل قیمتش فوق العاده است واقعا ,"['محل کرم', ' چربی متوسط', ' قیمت']","[' Positive', ' Neutral', ' Positive']"
این کرم پودر از نظر من رنگ خوبی داره چون پوست من خیلی سفیده و فقط چنتا از مارکای تولیدی رنگ پوستمو دارن مثل مک و مای و لنسور از بین این سه تا من لنسور رو بیشتر پسندیدم این کرم پودر پوشش دهی متوسط داره پس باید زیرش از کانسیلر استفاده کنید اما بستر سبکه و مناسب برای استفاده روزانه ,"['کرم پودر', ' پوشش دهی', ' کانسیلر', ' Mentioned for usage', ' قیمت', ' Not mentioned']","[' Positive', ' Neutral']"
این کرم پودر با توجه به رنگ طبیعی که داره برای استفاده روزمره مناسبه پوشش دهی متوسطی داره جلوه چندانی نداره به همین علت چندان مناسب مهمانیها و مجالس خاص نیست روی پوست خوب میشینه نمیماسه و طبیعیه بعد ۵_۶ ساعت احساس میکنی کلن کرم پودر رو صورتت نیست ولی در کل با توجه به قیمتش انتظار بیشتری ازش داشتم! ,"['کرم پودر', ' Normal coverage', ' Natural appearance', ' No artificial shine', ' قیمت', ' Disappointment', ' Expectation not met']","[' Neutral', ' Negative']"
این کمان اره مویی به نظر من که چند ماهه دارم ازش استفاده میکنم خوبه و هیچ گونه مشکلی نداره و شکل خودش رو هم از دست نمیده البته در صورتی که بلد نباشید با ان کار کنید مطمئنا کج میشه ولی برای من این اتفاق نیوفتاده و از من به شما نصیحت که همیشه کمان لولهای بخرید چون بهتره تیغههای همراهش هم کیفیت متوسط رو به بالا داره ,"['کمان اره مویی', ' شکل خودش رو از دست نمیده', ' تیغههای همراهش']","[' Positive', ' Neutral', ' Positive']"
این کوله پشتی کیفیت متوسط و تا حدودی قابل قبولی داره ولی به هیچ وجه به این قیمت نمیارزه نهایتا یک سوم این قیمت ارزش واقعیشه ظاهرش در عکس از ظاهر واقعیش قشنگ تره خوبیش اینه که جا داره نسبت به سایر کوله پشتیها ظاهرش به دلم نشست که خریدم وگرنه اصلا با این قیمت ارزش خرید نداره ,"['کوله پشتی', ' کیفیت متوسط', ' قیمت', ' ظاهر', ' جا داره']","[' Negative', ' Neutral', ' Negative', ' Positive', ' Positive']"
این کیف انچنان که بعضیا تعریف میکنن تعریفی نیست فکرکنم این دسته از افراذ تابحال کیف چرم نداشتن یه کیف معمولی با جنس چرم متوسط من تو پیشنهاد ویژه ۱۱۵ گرفتم جنس چرمش گوسفندیه و نازک توش هم استر زدن؛ چن چنتا کیف چرم داشتم میدونم که این جنس استحکام بالایی نداره مخصوصا تو قسمت دوخت پایین کیف ضمنا فضای تو کیف کوچیکه ابعاد یه کاغذ a۵ اگر تو پیشنهاد ویژه بگیرید بد نیست ,"['کیف چرم', ' جنس چرم', ' ابعاد کیف', ' قیمت']","[' Neutral', ' Neutral', ' Neutral', ' Neutral']"
این کیف تقریبا بهترین گزینه مشابه کیف اصلی ئه ظاهر اون ساده اس کیفیتش قابل قبوله و از همه مهمتر اینکه قیمتش مناسبه من کیف اصلی رو هم دارم تفاوت این ۲ باهم اینه که دوخت این مدل به نسبت مدل اصلی بی کیفیت است کیفیت ابر استفاده شده و جنس داخل کیف خیلی متوسط است البته این کیف ابر پهنتری به نسبت کیف اصلی داره که باعث میشه بیشتر محافظت کنه کیف اصلی یه لبه هم داره که این کیف نداره و این موضوع باعث میشه بعد از وارد کردن دستگاه درون این کیف خاک یا اشیاء بیرونی راحت به داخل ان نفوذ کنن در کل با این قیمت نه تنها چیز بهتر پیدا نمیکنید بلکه اصلا چیزی نمیشه پیدا کرد!!! پس اگر میخواهید ویتا رو سالم نگه دارید سریعا تا تموم نشده بخرید ,"[' کیف', ' ظاهر', ' Simple', ' قیمت', ' Acceptable', ' کیفیت', ' Average', ' جنس داخل کیف', ' Medium', ' اندازه پهنتر', ' Better than original', ' لبه', ' Absent', ' وارد کردن دستگاه درون کیف', ' Insecure', ' overall', ' The sentiment analysis is based on the provided review and may not reflect the general consensus or objective characteristics of the product.']","[' Positive', ' Negative\n\nNote']"
این گزینه روشن ماندن صفحه که اینقد روش مانور میرن رو نوکیا چندین ساله رو گوشی های وین فونش تحت عنوان تکنولوژی گلنس داره و حتی ازش تعریف هم نکرده. خیلی جالبه تازه رو پرچمدارهای اندرویدی این چیزارو میزارن و اینهمه هم تبلیغشونو میکنن. از لحاظ دوربین و صفحه نمایش و سایر امکانات هم بد نیست نگاهی به فیلمهای واقعی مقایسه گوشی های مایکروسافت با سایر برندها کنید. درکل اعداد و ارقام و تحریف های روی کاغذ اصلا ملاک ارزیابی محصولات نیست با تشکراز دیجی کالای عالی ,"[' صفحه نمایش', ' دوربین و صفحه نمایش و سایر امکانات', ' اعداد و ارقام و تحریف های روی کاغذ', ' تبلیغشونو میکنن']","[' Neutral', ' Neutral', ' Neutral', ' Neutral']"
این گلس رو برای یکی از دوستان تهیه کردم. به واسطه ۳D بودن این گلس در گوشه ها مشکل Halo effect پدیدار خواهد شد. لذا استفاده از گارد هایی که در گوشه ها از ضخامت بالایی برخوردار هستندتوصیه نمیشود زیرا با نصب این گارد ها باعث بلند شدن دور گلس میشود. راه حل بلندشدگی گلس استفاده از وازلین میباشد. شخصا از وازلین استفاده کردم و نتیجه مطلوب حاصل گردید. ,"['گلس', ' هالو افکت پدیدار خواهد شد', ' گارد ها', ' بلند شدن دور گلس', ' وزلین']","[' Neutral', ' Negative', ' Negative', ' Neutral', ' Positive']"
این گلس نسبت به قیمتش اصلا ارزش خرید ندارد و بسیار بی کیفیت است در مرحله اول برای نصب ترک خورد و شکست، بدون کمترین فشار یقینا این گلس توانایی محافظت از صفحه نمایش را ندارد. ,"['گلس', ' قیمت', ' نصب', ' فشار']","[' Negative', ' Negative', ' Negative', ' Neutral']"
این گوشواره پنج ماهه خریدم اما نه حافضه ی درست حسابی داره نه گلس و گاردش بدردم خورد نه میشه از مموری استفاده کرد. زمان خواب رفتنش رو نمیشه تغییر داد. خب یک کلام به نظرم بدرد نخور ,"['گوشواره', ' گلس و گاردش', ' مموری']","[' Negative', ' Negative', ' Negative']"
این گوشی اثر انگشت بسیار قوی دارد باتری خوبی هم دارد رنگ آبی را هم که من خریده ام بسیار زیباست دو ربین عالی دارد فقط تاچ صفحه اش مثل سامسونگ خوب نیست ولی بد هم نیست ,['گوشی'],"[' Positive\nاثر انگشت', ' Positive\nباتری', ' Positive\nرنگ آبی', ' Positive\nدو ربین', ' Positive\nتچ صفحه', ' Neutral/Negative']"
این گوشی از دو دوربین پرقدرت بهره می بره که می شه گفت دوربین سلفیش بی رقیبه، من چون به عکاسی علاقمندم بدون در نظر گرفتن سایر مشخصات این گوشی رو خریدم واز خریدم هم راضی هستم. ,['گوشی'],"[' Positive\nدو دوربین پرقدرت', ' Positive']"
این گوشی از لحاظ رابط کاربری و پشتیبانی بسیار عالیه، اما بدون اغراق بدترین باتری را سونی برای این گوشی در نظر گرفته و با توجه به قابلیت های گوشی باتری عملا از پشتیبانی مناسب و شارژ های مطلوب فاصله خیلی زیادی داره،. نقطه ضعف دیگه این گوشی استفاده از قاب پشتی گوشی به عنوان هیدسینگ برای پردازنده آون هست که عملا به دلیل گرمایش زیاد و داغ کردن دست کاربر جاذبه این گوشی رو تا حد قابل توجهی کاهش داده است. ,"['رابط کاربری و پشتیبانی', ' باتری', ' پردازنده آون']","[' Positive', ' Negative', ' Negative']"
این گوشی از هر نظر عالیه تنها اشکالش اینه که لرزشگیر نداره که برای خود من خیلی مهم نیست. در کل اگه مردد هستید بگم بهتون شک نکنید این گوشی بهترین گوشی تو این رنجه قید هواوی رو بزنید ,"['گوشی', ' لرزشگیر']","[' Positive', ' Negative']"
